{
  "$schema": "http://json-schema.org/draft-07/schema#",
  "$id": "https://kroma.dev/module.schema.json",
  "title": "KROMA module manifest",
  "description": "Schema for a module's module.json (and the YAML frontmatter of a .module.md).",
  "type": "object",
  "additionalProperties": false,
  "required": ["apiVersion", "id", "name", "version"],
  "properties": {
    "apiVersion": {
      "const": 2,
      "description": "The manifest contract this module is built against. A server that speaks a different one refuses the bundle rather than reading it on a best-effort basis, because the fields that moved between versions parse as absent, not as errors."
    },
    "id": {
      "type": "string",
      "pattern": "^[a-z0-9]+(\\.[a-z0-9-]+)+$",
      "description": "Reverse-DNS identifier, e.g. tv.kroma.torrents. The runtime join key."
    },
    "name": {
      "type": "string",
      "minLength": 1
    },
    "version": {
      "type": "string",
      "pattern": "^[0-9]+\\.[0-9]+\\.[0-9]+"
    },
    "description": {
      "type": "string"
    },
    "minServer": {
      "type": "string",
      "description": "Minimum KROMA server version the module needs: a bare version (\"0.2.0\" = at least 0.2.0) or a full semver range (\">=0.2, <0.4\"). Checked at install and spawn; absent = any server."
    },
    "library": {
      "type": "boolean",
      "description": "A library module: its `.kmod` ships no native binary (its code is co-linked into the processes that need it), so the supervisor registers it but spawns no process. E.g. the release-name parser."
    },
    "dependencies": {
      "description": "Hard dependencies as a package.json-style map { \"<id>\": \"<semver range>\" } (a bare \"*\" means any version). A legacy array of ids / 'id@range' strings / { id, version } objects is also accepted. Enforced on the backend.",
      "oneOf": [
        {
          "type": "object",
          "additionalProperties": {
            "type": "string"
          }
        },
        {
          "type": "array"
        }
      ]
    },
    "optionalDependencies": {
      "description": "Soft dependencies (same shape as dependencies): version-checked and ordered first when present, but not required.",
      "oneOf": [
        {
          "type": "object",
          "additionalProperties": {
            "type": "string"
          }
        },
        {
          "type": "array"
        }
      ]
    },
    "requires": {
      "type": "array",
      "description": "Capability dependencies, satisfied by any module providing the (kind[, id]).",
      "items": {
        "type": "object",
        "additionalProperties": false,
        "required": ["kind"],
        "properties": {
          "kind": {
            "type": "string",
            "minLength": 1
          },
          "id": {
            "type": "string",
            "minLength": 1
          }
        }
      }
    },
    "provides": {
      "type": "array",
      "items": {
        "type": "object",
        "additionalProperties": false,
        "required": ["kind", "id"],
        "properties": {
          "kind": {
            "type": "string",
            "minLength": 1
          },
          "id": {
            "type": "string",
            "minLength": 1
          },
          "label": {
            "type": "string",
            "minLength": 1,
            "description": "Display name / i18n key shown in the admin add-picker (engine capabilities)."
          },
          "flow": {
            "type": "string",
            "minLength": 1,
            "description": "A non-form add-flow discriminator (e.g. \"definition\"); the host page renders it."
          },
          "fields": {
            "type": "array",
            "description": "The add-form schema the admin renders for this engine.",
            "items": {
              "type": "object",
              "additionalProperties": false,
              "required": ["key", "label", "type"],
              "properties": {
                "key": {
                  "type": "string",
                  "minLength": 1
                },
                "label": {
                  "type": "string",
                  "minLength": 1
                },
                "type": {
                  "enum": ["string", "bool", "number", "select"]
                },
                "default": {
                  "type": "string"
                },
                "options": {
                  "type": "array",
                  "items": {
                    "type": "string"
                  }
                },
                "placeholder": {
                  "type": "string"
                },
                "secret": {
                  "type": "boolean"
                },
                "required": {
                  "type": "boolean"
                }
              }
            }
          }
        }
      }
    },
    "ports": {
      "type": "array",
      "description": "Cross-module RPC contracts this module SERVES, by name (e.g. \"torznab\", \"indexer-db\"). Distinct from `provides`, which describes user-configurable capabilities: this is the machine wiring a consumer resolves against, so no one has to name a module id.",
      "items": {
        "type": "string",
        "pattern": "^[a-z][a-z0-9-]*$"
      }
    },
    "permissions": {
      "type": "array",
      "items": {
        "type": "string",
        "minLength": 1
      }
    },
    "feRemote": {
      "type": "object",
      "additionalProperties": false,
      "required": ["module"],
      "description": "Frontend Module Federation remote (runtime-loaded modules). The entry URL is derived by the server as /modules/<id>/remoteEntry.js.",
      "properties": {
        "module": {
          "type": "string",
          "minLength": 1
        }
      }
    },
    "config": {
      "type": "array",
      "items": {
        "type": "object",
        "additionalProperties": false,
        "required": ["key", "label", "type"],
        "properties": {
          "key": {
            "type": "string",
            "minLength": 1
          },
          "label": {
            "type": "string",
            "minLength": 1
          },
          "type": {
            "enum": ["string", "bool", "number", "select"]
          },
          "default": {
            "type": "string"
          },
          "options": {
            "type": "array",
            "items": {
              "type": "string"
            }
          },
          "placeholder": {
            "type": "string"
          },
          "secret": {
            "type": "boolean"
          },
          "required": {
            "type": "boolean"
          }
        }
      }
    }
  }
}
