{
  "apiVersion": 2,
  "id": "tv.kroma.remote",
  "name": "Remote access",
  "version": "0.1.3",
  "minServer": "0.1.4",
  "provides": [
    {
      "kind": "remote-access",
      "id": "cloudflared"
    }
  ],
  "description": "Public HTTPS access: the share / Quick Connect URL plus an optional managed Cloudflare Tunnel connector. Disable it to hide the page + routes."
}
