{
  "apiVersion": 2,
  "id": "tv.kroma.scene",
  "name": "Release parser",
  "version": "0.1.1",
  "minServer": "0.1.4",
  "library": true,
  "dependencies": [],
  "provides": [
    {
      "kind": "release-parser",
      "id": "scene"
    }
  ],
  "description": "Scene / P2P release-name parsing and scoring for the acquisition stack."
}
