{
  "apiVersion": 2,
  "id": "tv.kroma.acquisition",
  "name": "Acquisition",
  "version": "0.1.9",
  "minServer": "0.1.4",
  "dependencies": {
    "tv.kroma.torrents": "^0.1.0"
  },
  "requires": [
    {
      "kind": "indexer-engine"
    },
    {
      "kind": "download-client"
    }
  ],
  "description": "The acquisition feature: interactive/manual release search, quality scoring, grab + import, and the automatic wanted-list pass. Rides on the Downloads engine and the indexers. Disable it to remove search/grab/auto and hide the settings page.",
  "ports": ["acquisition-search"]
}
