{
  "apiVersion": 2,
  "id": "tv.kroma.whisper",
  "name": "Whisper transcription",
  "version": "0.1.2",
  "minServer": "0.1.4",
  "dependencies": [],
  "provides": [
    {
      "kind": "transcriber",
      "id": "whisper"
    }
  ],
  "description": "In-process Whisper subtitle transcription (candle).",
  "ports": ["whisper"]
}
