{
  "apiVersion": 2,
  "id": "tv.kroma.mdns",
  "name": "mDNS discovery",
  "version": "0.1.1",
  "minServer": "0.1.4",
  "dependencies": [],
  "provides": [
    {
      "kind": "discovery",
      "id": "mdns"
    }
  ],
  "description": "mDNS / DNS-SD advertising so LAN clients find the server automatically."
}
